{
    "n_rows": 5,
    "n_columns": 5,
    "provenance": {
        "created by": {
            "name": "metasyn",
            "version": "0.4.0"
        },
        "creation time": "2023-08-07T12:04:40.669740"
    },
    "vars": [
        {
            "name": "ID",
            "type": "discrete",
            "dtype": "Int64",
            "prop_missing": 0.0,
            "distribution": {
                "implements": "core.unique_key",
                "provenance": "builtin",
                "class_name": "UniqueKeyDistribution",
                "parameters": {
                    "low": 1,
                    "consecutive": 1
                }
            }
        },
        {
            "name": "fruits",
            "type": "categorical",
            "dtype": "Categorical",
            "prop_missing": 0.0,
            "distribution": {
                "implements": "core.multinoulli",
                "provenance": "builtin",
                "class_name": "MultinoulliDistribution",
                "parameters": {
                    "labels": [
                        "apple",
                        "banana"
                    ],
                    "probs": [
                        0.4,
                        0.6
                    ]
                }
            }
        },
        {
            "name": "B",
            "type": "discrete",
            "dtype": "Int64",
            "prop_missing": 0.0,
            "distribution": {
                "implements": "core.poisson",
                "provenance": "builtin",
                "class_name": "PoissonDistribution",
                "parameters": {
                    "mu": 3.0
                }
            }
        },
        {
            "name": "cars",
            "type": "categorical",
            "dtype": "Categorical",
            "prop_missing": 0.0,
            "distribution": {
                "implements": "core.multinoulli",
                "provenance": "builtin",
                "class_name": "MultinoulliDistribution",
                "parameters": {
                    "labels": [
                        "audi",
                        "beetle"
                    ],
                    "probs": [
                        0.2,
                        0.8
                    ]
                }
            }
        },
        {
            "name": "optional",
            "type": "discrete",
            "dtype": "Int64",
            "prop_missing": 0.2,
            "distribution": {
                "implements": "core.discrete_uniform",
                "provenance": "builtin",
                "class_name": "DiscreteUniformDistribution",
                "parameters": {
                    "low": -30,
                    "high": 301
                }
            }
        }
    ]
}